<?xml version="1.0" encoding="UTF-8"?>
<h5-code-assist xmlns:xsi="http://www.w3.org/2001/XMLSchema-instance"
	xsi:noNamespaceSchemaLocation="h5-code-assist.xsd">
	<controller suffix="Controller">
		<function returnType="ReturnType1" name="test1">
			<argument name="arg1" type="Object" />
			<argument name="arg2" type="Object" />
			<description><![CDATA[<b>テスト1テスト1</b>]]></description>
		</function>
		<varRef key="varRef" className="String" />
	</controller>
	<logic controllerSuffix="Controller" suffix="Logic">
		<function returnType="ReturnType1" name="test1">
			<argument name="arg1" type="Object" />
			<argument name="arg2" type="Object" />
			<description><![CDATA[<b>テスト1テスト1</b>]]></description>
		</function>
		<varRef key="varRef" className="String" />
	</logic>
	<eventcontext controllerSuffix="Controller">
		<function returnType="ReturnType1" name="test1">
			<argument name="arg1" type="Object" />
			<argument name="arg2" type="Object" />
			<description><![CDATA[<b>テスト1テスト1</b>]]></description>
		</function>
		<varRef key="varRef" className="String" />
	</eventcontext>
	<initcontext controllerSuffix="Controller">
		<function returnType="ReturnType1" name="test1">
			<argument name="arg1" type="Object" />
			<argument name="arg2" type="Object" />
			<description><![CDATA[<b>テスト1テスト1</b>]]></description>
		</function>
		<varRef key="varRef" className="String" />
	</initcontext>
</h5-code-assist>
